<?xml version="1.0"?>

<xs:schema version="1.0"
           xmlns:xs="http://www.w3.org/2001/XMLSchema"
           elementFormDefault="qualified">
    
    <xs:element name="recetas">
        <xs:complexType>
            <xs:sequence>
                <xs:element name="receta" minOccurs="1" maxOccurs="unbounded">
                    <xs:complexType>
                        <xs:sequence>
                            <xs:element name="nombre" type="xs:string"/>
                            <xs:element name="descripcion" type="xs:string"/>
                            <xs:element name="tiempo">
                                <xs:complexType>
                                    <xs:attribute name="preparacion" type="xs:integer"/>
                                </xs:complexType>
                            </xs:element>
                            <xs:element name="ingredientes">
                                <xs:complexType>
                                    <xs:sequence>
                                        <xs:element name="ingrediente" maxOccurs="unbounded">
                                            <xs:complexType>
                                                <xs:sequence>
                                                    <xs:element name="nombreIngrediente" type="xs:string"/>
                                                    <xs:element name="cantidad" minOccurs="0" maxOccurs="1">
                                                        <xs:complexType>
                                                            <xs:simpleContent>
                                                                <xs:extension base="xs:integer">
                                                                     <xs:attribute name="unidad" type="xs:string"/>
                                                                </xs:extension>
                                                            </xs:simpleContent>    
                                                        </xs:complexType>
                                                    </xs:element>
                                                </xs:sequence>
                                            </xs:complexType>
                                        </xs:element>
                                    </xs:sequence>
                                </xs:complexType>
                            </xs:element>
                            <xs:element name="instrucciones">
                                <xs:complexType>
                                    <xs:sequence>
                                        <xs:element name="paso" type="xs:string" maxOccurs="10"/>
                                    </xs:sequence>
                                </xs:complexType>
                            </xs:element>
                        </xs:sequence>
                        <xs:attribute name="plato" type="xs:string"/>       
                    </xs:complexType>
                </xs:element>
            </xs:sequence>
        </xs:complexType>
    </xs:element>
</xs:schema>
